{
  "version": "1.0.7",
  "download_url": "https://github.com/Ackold26/Aurora_Econometrica/releases/download/v1.0.7/Aurora.AI.Econometrica_1.0.7_x64-setup.exe",
  "checksum": "sha256:67265350e7bee36aee27f5d7c842b1d03eda372591b07927f61080da47c0619a",
  "release_notes": "v1.0.7: Dual-mode, insights engine, PPTX/XLSX export, adstock auto-select, model versioning",
  "mandatory": false,
  "min_version": "1.0.0"
}
