{
  "version": "0.7.5",
  "download_url": "https://quzhkfvglqmppxcrindh.supabase.co/storage/v1/object/public/updates/creative/0.7.5-setup.exe",
  "checksum": "sha256:d13b9c1f1c22c65fe52ccc0e5f37dbb0a75d24aa4825dc9a8042f653f6d6dabe",
  "release_notes": "v0.7.5: UX Redesign v2.0, CommandBrief, PSY C3-C7",
  "mandatory": false,
  "min_version": "0.3.2"
}
