{
  "version": "0.5.7",
  "download_url": "https://github.com/Ackold26/aurora-releases/releases/download/v0.5.7-oracle/Aurora.AI.Synthetic.Research_0.5.7_x64-setup.exe",
  "checksum": "sha256:0f5d15cd222a5122479e73c6933adbf4880cf7cf4ae47f123d7099aaf91f8f62",
  "release_notes": "v0.5.7: долгое исследование в облаке больше не обрывается на 15-й минуте, а остановка сервером объясняется понятным текстом; при предварительных материалах экран не показывает вердикт «лидер» и «отсев»; тест креатива запускается без файла; бриф, загруженный файлом, не теряет раскадровку; длинный текст в полях брифа и плана виден целиком.",
  "mandatory": false,
  "min_version": "0.3.2"
}
