{
  "version": "0.8.5",
  "download_url": "https://quzhkfvglqmppxcrindh.supabase.co/storage/v1/object/public/updates/docmaster/Aurora-AI-Docu-Master_0.8.5_x64-setup.exe",
  "checksum": "sha256:34bbf07a457a645887fa75d1c14baba7b43d0eb1e06affee4fde4062393bec3b",
  "release_notes": "v0.8.5: Thin Binary Architecture + Aurora AI v3 — dynamic content packs, frontend updates without reinstall, per-cabinet vault versioning",
  "mandatory": false,
  "min_version": "0.7.0"
}
