{
  "version": "2.5.10",
  "download_url": "https://github.com/Ackold26/aurora-releases/releases/download/v2.5.10/Optimizer_MMM_2.5.10_x64-setup.exe",
  "checksum": "sha256:5af45d359c8e803577614f2c5295e2372f4deb2844263048ca38bb4d439b494d",
  "release_notes": "v2.5.10: на файлах, где у канала есть и бюджет, и физическая метрика (TRP, показы, контакты), обучение снова открывается на всех путях – и после «Принять авто-настройку», и при ручной настройке; экран «Подтверждение», шапка шага и подсказки считают каналы, бюджет и запас данных только по включённым каналам; колонки с TRP, GRP, охватом и показами не попадают в модель как рубли даже при медленном запуске модуля расчётов; строка состояния внизу показывает, запускается модуль расчётов, готов или не запустился, а медленный запуск (до двух минут) больше не прерывается; читаются недели вида «2023-W01»; декомпозиция предупреждает, если модель обучена на других датах, чем в загруженном файле; в отчётах заголовок «Риск» ставится только по каналам, которые рекомендуется остановить, лидер с рекомендацией сократить бюджет больше не называется «нарастить», список отстающих каналов одинаков в веб-отчёте и презентации, на графике mROAS показаны все каналы, а декомпозиция на слайде читается сверху вниз. С версии 2.4.x: удалите прежнюю через «Параметры → Приложения» (данные приложения не удалять) и установите 2.5.10 вручную.",
  "mandatory": false,
  "min_version": "1.0.0"
}
