{
  "version": "0.8.5",
  "download_url": "https://quzhkfvglqmppxcrindh.supabase.co/storage/v1/object/public/updates/agency/Aurora-AI-Agency_0.8.5_x64-setup.exe",
  "checksum": "sha256:68fd10d2977dab6d26a4f2f1922492a015be90e12e0b2e1a881ce7a5e1cd04a3",
  "release_notes": "v0.8.5: Thin Binary + Aurora AI v3 + vault self-heal",
  "mandatory": false,
  "min_version": "0.7.0"
}
