{
  "version": "0.8.5",
  "download_url": "https://quzhkfvglqmppxcrindh.supabase.co/storage/v1/object/public/updates/marketing/Aurora-AI-Marketing-Analytics_0.8.5_x64-setup.exe",
  "checksum": "sha256:c0f952618fd7f415fed90a86fb25218d65b7d7f27309c50658f0397406dc1792",
  "release_notes": "v0.8.5: Thin Binary + Aurora AI v3 + vault self-heal",
  "mandatory": false,
  "min_version": "0.7.0"
}
