{
  "version": "0.8.5",
  "download_url": "https://quzhkfvglqmppxcrindh.supabase.co/storage/v1/object/public/updates/prmaster/Aurora-AI-PR-Master_0.8.5_x64-setup.exe",
  "checksum": "sha256:c3f2dda894bb997c01503a05380ffe09d261919d2c4059b94746626949be3f66",
  "release_notes": "v0.8.5: Thin Binary Architecture + Aurora AI v3 — dynamic content packs, frontend updates without reinstall, per-cabinet vault versioning",
  "mandatory": false,
  "min_version": "0.8.5"
}
